{
  "schema": 1,
  "id": "sardegna-summer",
  "title": "Sardegna: coasts, islands and Cagliari",
  "destination": "Sardegna, Italy",
  "startDate": "2026-06-05",
  "endDate": "2026-06-15",
  "summary": "12 day plans over 11 dates, in three bases: the wild east coast, the northeast islands and Cagliari with its southern beaches.",
  "note": "This plan was tested and done by Jihad for his summer trip.",
  "center": [9.2, 39.8],
  "zoom": 7,
  "theme": { "phases": ["#1B4965", "#7B2D8E", "#B44215"] },
  "phases": [
    {
      "id": "p1",
      "title": "Ogliastra",
      "subtitle": "Wild east coast. Hotel Orri, Tortolì, 3 nights.",
      "colorKey": 1,
      "days": [
        {
          "dayNumber": 1,
          "date": "2026-06-05",
          "title": "Arrival and Arbatax sunset",
          "mode": "driving",
          "stops": [
            { "id": "1a", "name": "Hotel Orri: check in", "type": "lodging", "time": "16:00", "dwell": 30, "lat": 39.9252, "lon": 9.6663, "tags": [], "desc": "Drop bags, head out. Rooftop bar for sunset.", "links": [{ "kind": "web", "label": "Website", "url": "http://www.hotelorri.it/" }], "visited": false },
            { "id": "1b", "name": "Rocce Rosse, Arbatax", "type": "gem", "time": "17:00", "dwell": 45, "lat": 39.9392, "lon": 9.7095, "tags": ["gem"], "desc": "10 min. Red porphyry rocks at the harbour. Free. Golden hour. Sneakers for scrambling.", "links": [], "visited": false },
            { "id": "1c", "name": "Santa Maria Navarrese", "type": "dining", "time": "18:30", "dwell": 60, "lat": 39.9883, "lon": 9.6862, "tags": ["food"], "desc": "Optional. Fishing village. 1000-year-old olive tree. Sunset aperitivo. Scout the Day 3 boat port.", "links": [], "visited": false }
          ],
          "tips": ["Easy evening, you have just arrived."],
          "food": "Tortolì: culurgiones (stuffed pasta), porceddu (suckling pig). Ask the hotel.",
          "bookings": [],
          "packing": []
        },
        {
          "dayNumber": 2,
          "date": "2026-06-06",
          "title": "Pedra Longa and Selvaggio Blu hike",
          "mode": "driving",
          "stops": [
            { "id": "2a", "name": "Pedra Longa", "type": "gem", "time": "08:00", "dwell": 30, "lat": 40.0277, "lon": 9.7071, "tags": ["swim", "gem"], "desc": "30 min. 128 m sea stack. Swim or snorkel at the base. Cliff jumping. Restaurant at the top.", "links": [], "visited": false },
            { "id": "2b", "name": "Selvaggio Blu hike", "type": "hike", "time": "09:30", "dwell": 120, "lat": 40.0281, "lon": 9.7054, "tags": ["hike"], "desc": "Italy's most famous coastal trail. The first 2 to 3 km are jaw-dropping. Turn back at any point. The full trail is a technical expedition, so do only the introductory section.", "links": [{ "kind": "hike", "label": "Komoot", "url": "https://www.komoot.com/highlight/280266" }], "visited": false },
            { "id": "2c", "name": "Gorropu Canyon (alternative)", "type": "hike", "dwell": 180, "lat": 40.1442, "lon": 9.49, "tags": ["hike", "gem", "optional"], "desc": "Europe's deepest gorge, with 500 m limestone walls. 40 min drive from Tortolì, near Urzulei. 2 to 3 h hike along a riverbed between towering cliffs. Full half-day. Choose this or Selvaggio Blu, not both.", "links": [], "visited": false }
          ],
          "tips": ["Start early: the coast is exposed by noon.", "1.5 L water, sun protection, proper shoes.", "Optional alternative: Gorropu Canyon, a full half-day canyon walk instead of the coastal trail."],
          "food": "Pedra Longa restaurant after the hike, with an extraordinary terrace view.",
          "bookings": [],
          "packing": ["1.5 L water", "Sun protection", "Proper shoes"]
        },
        {
          "dayNumber": 3,
          "date": "2026-06-07",
          "title": "Boat cruise: Goloritzé, Mariolu and more",
          "mode": "driving",
          "stops": [
            { "id": "3a", "name": "Santa Maria Navarrese port", "type": "boat", "time": "08:30", "dwell": 30, "lat": 39.9883, "lon": 9.6862, "tags": ["book", "boat"], "desc": "Arrive 30 min before. The boat leaves at 9 AM sharp. Max 12 passengers.", "links": [{ "kind": "book", "label": "GetYourGuide", "url": "https://www.getyourguide.com/santa-maria-navarrese-l159484/guided-cruise-to-cala-goloritze-cala-mariolu-cala-gabbiani-and-cala-biriala-t849589/" }], "visited": false },
            { "id": "3b", "name": "Caves and fjords cruise", "type": "boat", "time": "09:00", "dwell": 90, "lat": 40.05, "lon": 9.7, "tags": ["boat"], "desc": "North along the Baunei coast. Sea caves are reachable only by boat.", "links": [], "visited": false },
            { "id": "3c", "name": "Cala Goloritzé", "type": "swim", "time": "10:30", "dwell": 30, "lat": 40.1085, "lon": 9.6893, "tags": ["swim"], "desc": "UNESCO site. 30 m visibility. 143 m pinnacle. Swim from the boat.", "links": [], "visited": false },
            { "id": "3d", "name": "Piscine di Venere", "type": "swim", "time": "11:00", "dwell": 30, "lat": 40.116, "lon": 9.683, "tags": ["swim"], "desc": "Natural turquoise pools. Quick swim.", "links": [], "visited": false },
            { "id": "3e", "name": "Cala Mariolu", "type": "swim", "time": "11:30", "dwell": 90, "lat": 40.1239, "lon": 9.6758, "tags": ["swim"], "desc": "1.5 h. White pebbles, turquoise water, fish. Water shoes and snorkel.", "links": [], "visited": false },
            { "id": "3f", "name": "Cala Biriala", "type": "swim", "time": "13:30", "dwell": 90, "lat": 40.1333, "lon": 9.6695, "tags": ["swim"], "desc": "1.5 h. Calm waters. Grotta del Fico is optional, about €10.", "links": [], "visited": false },
            { "id": "3g", "name": "Cala dei Gabbiani", "type": "swim", "time": "15:30", "dwell": 90, "lat": 40.1438, "lon": 9.6563, "tags": ["swim"], "desc": "1.5 h. Wild and remote. Last stop.", "links": [], "visited": false },
            { "id": "3h", "name": "Return to port", "type": "boat", "time": "17:00", "dwell": 0, "lat": 39.9883, "lon": 9.6862, "tags": [], "desc": "Back around 5 PM.", "links": [], "visited": false }
          ],
          "tips": ["Pack snacks or lunch.", "Snorkel gear, water shoes, sunscreen."],
          "food": "Big seafood dinner.",
          "bookings": [{ "label": "Guided cruise", "url": "https://www.getyourguide.com/santa-maria-navarrese-l159484/guided-cruise-to-cala-goloritze-cala-mariolu-cala-gabbiani-and-cala-biriala-t849589/" }],
          "packing": ["Snorkel gear", "Water shoes", "Sunscreen", "Snacks or lunch"]
        },
        {
          "dayNumber": 4,
          "date": "2026-06-08",
          "title": "Ghost village, then Budoni",
          "mode": "driving",
          "stops": [
            { "id": "4a", "name": "Gairo Vecchio", "type": "gem", "time": "07:30", "dwell": 60, "lat": 39.8481, "lon": 9.4989, "tags": ["hike", "gem"], "desc": "45 min south. Ruins and fig trees, abandoned in 1951. SS198 from Gairo Sant'Elena. Free. Check safe public access to the ruins.", "links": [], "visited": false },
            { "id": "4b", "name": "Castello della Fava, Posada", "type": "sight", "time": "10:30", "dwell": 60, "lat": 40.6381, "lon": 9.7239, "tags": ["culture", "food"], "desc": "Hilltop castle. €4. Charming village below.", "links": [], "visited": false },
            { "id": "4c", "name": "Hotel Castello, Budoni", "type": "lodging", "time": "14:00", "dwell": 30, "lat": 40.7396, "lon": 9.691, "tags": [], "desc": "Pool and sea views.", "links": [{ "kind": "web", "label": "Website", "url": "http://www.castellobudoni.com/" }], "visited": false }
          ],
          "tips": ["Check out of Hotel Orri by 11 AM.", "About 2.5 h of driving in total."],
          "food": "Posada: pane frattau.",
          "bookings": [],
          "packing": ["Check-out complete", "Fuel and parking plan"]
        }
      ]
    },
    {
      "id": "p2",
      "title": "Northeast",
      "subtitle": "Islands and wild beaches. Hotel Castello, Budoni, 3 nights.",
      "colorKey": 2,
      "days": [
        {
          "dayNumber": 5,
          "date": "2026-06-08",
          "title": "La Cinta beach (afternoon)",
          "mode": "driving",
          "stops": [
            { "id": "5a", "name": "La Cinta Beach", "type": "swim", "time": "16:00", "dwell": 150, "lat": 40.7852, "lon": 9.671, "tags": ["swim"], "desc": "15 min. Huge white sand beach. Walk south. €1.50 per hour parking.", "links": [], "visited": false }
          ],
          "tips": ["Easy afternoon."],
          "food": "San Teodoro harbour for fish.",
          "bookings": [],
          "packing": []
        },
        {
          "dayNumber": 6,
          "date": "2026-06-09",
          "title": "Hidden beaches and Tavolara views",
          "mode": "driving",
          "stops": [
            { "id": "6a", "name": "Spiaggia delle Vacche", "type": "swim", "time": "08:00", "dwell": 150, "lat": 40.8583, "lon": 9.6735, "tags": ["swim", "hike", "gem"], "desc": "Rough road. Go before 10 AM. Hidden coves past the main beach. No facilities.", "links": [], "visited": false },
            { "id": "6b", "name": "Capo Coda Cavallo", "type": "swim", "time": "11:30", "dwell": 90, "lat": 40.8408, "lon": 9.7234, "tags": ["swim"], "desc": "Tavolara across the strait. Snorkeling. Free parking.", "links": [], "visited": false },
            { "id": "6c", "name": "Sa Curcurica Lagoon (add-on)", "type": "gem", "dwell": 60, "lat": 40.3741, "lon": 9.7089, "tags": ["gem", "optional"], "desc": "Coastal lagoon near Orosei, 30 min south of Budoni. Flamingos, herons and other birdlife. Nice for an early morning walk or a sunset detour. Free, open access.", "links": [], "visited": false }
          ],
          "tips": ["Rough roads mean fewer people.", "Optional: Sa Curcurica lagoon near Orosei, good early morning or at sunset."],
          "food": "Pack a picnic.",
          "bookings": [],
          "packing": ["Picnic", "Water shoes"]
        },
        {
          "dayNumber": 7,
          "date": "2026-06-10",